Software Malicioso,Indicador 1,Indicador 2,Indicador 3,Indicador 4,Indicador 5,Indicador 6,Indicador 7,Indicador 8
Tipo 01,Malware,Your computer slows down.,Your screen is inundated with annoying ads.,Your system crashes. ,You notice a mysterious loss of disk space.,There’s a weird increase in your system’s Internet activity.,Your browser settings change.,Your antivirus product stops working,You lose access to your files or your entire computer.
Tipo 02,Adware,Advertisements appear in places they shouldn’t be.,Your web browser’s homepage has mysteriously changed without your permission.,Web pages that you typically visit are not displaying properly.,Website links redirect to sites different from what you expected.,Your web browser slows to a crawl.,"New toolbars, extensions, or plugins suddenly populate your browser.",Your Mac starts automatically installing unwanted software applications.,Your browser crashes.
Tipo 03,Spyware,Advertisements appear in places they shouldn’t be.,Web pages that you typically visit are not displaying properly.,Website links redirect to sites different from what you expected.,Your web browser slows to a crawl.,Your Mac starts automatically installing unwanted software applications.,Your browser crashes., , 
Tipo 04,Phishing ,"Security vulnerabilities, e.g. backdoors and exploits. An exploit is a security vulnerability in your device’s hardware or software that can be abused or exploited to gain unauthorized access. Software vulnerabilities are also known as “software bugs” or just “bugs” for short. Exploits are an unintentional byproduct of hardware and software manufacturing. Mistakes happen and bugs manage to find their way in to even the most polished consumer technology. Backdoors, on the other hand, are put in place on purpose as a way to quickly gain access to your system after the fact. Sometimes the hardware and software makers themselves put the backdoors in. More often than not, however, cybercriminals will use an exploit to gain initial access to your system then install a permanent backdoor for future access.","Phishing and spoofing. These two threats are often used in tandem. Phishing happens whenever criminals try to get you to perform some sort of action such as clicking a link to a malware-laden website, opening an infected email attachment (aka malspam), or giving up your login credentials. Spoofing refers to the act of disguising phishing emails and websites so that they appear to be from and by individuals and organizations you trust.","Misleading marketing. Spyware authors love to present their spyware programs as useful tools to download. It might be an Internet accelerator, new download manager, hard disk drive cleaner, or an alternative web search service. Beware this kind of “bait,” because installing it can result in inadvertent spyware infection. And even if you eventually uninstall the “useful” tool that initially introduced the infection, the spyware remains behind and continues to function.","Software bundles. Who doesn’t love free software (freeware)? Except when it’s a host program that conceals a malicious add-on, extension, or plugin. Bundleware may look like necessary components, but they are nonetheless spyware, which, again, remains even if you uninstall the host application. Making matters worse, you may find that you actually agreed to install the spyware when you accepted the terms of service for the original application.","Trojans. Broadly speaking, if malware pretends to be something it’s not—that means it’s a Trojan. That said, most Trojans today are not threats in and of themselves. Rather, cybercriminals use Trojans to deliver other forms of malware, like cryptojackers, ransomware, and viruses.", , , 
Tipo 05,TrickBot,"Os trojans são projetados para se infiltrarem furtivamente no computador da vítima e permanecerem silenciosos, assim, nenhum sintoma específico é claramente visível numa máquina infectada.","Esta ameaça é geralmente distribuída por meio de e-mails de phishing direcionados que utilizam várias desculpas como iscas, como assuntos atuais, problemas ou envios relacionados ao domínio corporativo do e-mail da vítima ou questões financeiras (faturas, cobrança de títulos, multas de trânsito não pagas, entre outros).","Esses e-mails geralmente incluem links para sites maliciosos ou infectados, ou anexos de vários tipos: principalmente documentos do tipo Excel, Word ou ZIP. Estes envios vêm de vários locais ao redor do mundo, frequentemente utilizando contas de vítimas comprometidas em campanhas antigas para distribuir sem apontar para um alvo específico.","Além das comunicações através de falsos e-mails, o Trickbot foi detectado em várias ocasiões, aproveitando as vulnerabilidades para poder fazer movimentos laterais dentro da rede de uma vítima já infectada. Por exemplo, os famosos exploits EternalBlue e EternalRomance no protocolo do Server Message Block (SMB). Embora essas vulnerabilidades tenham sido corrigidas em 2017, ainda há um grande número de computadores que não receberam atualizações desde então, tornando o movimento lateral uma dor de cabeça para as organizações vítimas do Trickbot.","Por exemplo, um dos módulos que o Trickbot contém alimenta um dos plug-ins mais antigos do Trickbot: aquele que é responsável por apontar para sites de interesse (principalmente bancários ou financeiros) e modificar o conteúdo que o usuário infectado vê por meio de injeções web.", , , 
